культура,имя_бога,функция,атрибуты,символ
греческая,Зевс,"бог неба, грома и молний, ведающий всем миром...",Спарсено из Википедии,🏛️
греческая,Афродита,богиня красоты и любви...,Спарсено из Википедии,🏛️
скандинавская,Один,верховный бог в германо-скандинавской мифологии...,Спарсено из Википедии,⚔️
скандинавская,Тор,"бог грома и бури, защищающий богов и людей...",Спарсено из Википедии,⚔️
славянская,Перун,бог-громовержец в славянской мифологии...,Спарсено из Википедии,🌿
славянская,Велес,"божество в славянской мифологии, покровитель сказителей...",Спарсено из Википедии,🌿
славянская,Мать,сыра земля2...,Спарсено из Википедии,🌿
